{
  "assignment_digest": "sha256:fa27054e19123a4a5c795e3460ef312c34139280f8cdaa1ce198a529543df454",
  "authority_account_id": "042360977644",
  "authorized_mutations": [
    "sso:PutInlinePolicyToPermissionSet",
    "sso:ProvisionPermissionSet"
  ],
  "change_set_name": "scanalyze-platform-authority-bootstrap-20300101000000",
  "change_set_name_digest": "sha256:8b8ac378fe7605ce7de2b1363294deac57b282e743461443cda262fb99e9965d",
  "direct_human_sso_mutation_authorized": false,
  "expected_artifact_code_sha256": "AAAAAAAAAAAAAAAAAAAAAAAAAAAAAAAAAAAAAAAAAAA=",
  "expected_boto3_version": "1.40.1",
  "expected_botocore_version": "1.40.1",
  "expected_code_signing_config_arn": "arn:aws:lambda:us-east-1:042360977644:code-signing-config:csc-0123456789abcdefg",
  "expected_signing_profile_version_arn": "arn:aws:signer:us-east-1:042360977644:/signing-profiles/ScanalyzePlanRepair/0123456789",
  "function_qualifiers": {
    "plan": "plan-v1",
    "reconcile": "reconcile-v1",
    "repair": "repair-v1"
  },
  "function_versions": {
    "plan": "1",
    "reconcile": "3",
    "repair": "2"
  },
  "identity_store_id": "d-0123456789",
  "identity_center_kms_key_arn": null,
  "identity_center_kms_mode": "AWS_OWNED_KMS_KEY",
  "instance_arn": "arn:aws:sso:::instance/ssoins-0123456789ABCDEF",
  "intent_digest": "sha256:4394b4815eff6f5215f1a43160421cf1c1e21205113e58c0219680ed2e7d1c17",
  "invocation_authority_graph_digest": "sha256:dddddddddddddddddddddddddddddddddddddddddddddddddddddddddddddddd",
  "ledger_kms_key_arn": "arn:aws:kms:us-east-1:042360977644:key/01234567-89ab-cdef-0123-456789abcdef",
  "ledger_table_name": "scanalyze-platform-authority-plan-policy-repair-ledger",
  "management_account_id": "839393571433",
  "not_after": "2026-08-30T01:15:00Z",
  "not_before": "2026-08-30T01:00:00Z",
  "permission_set_arn": "arn:aws:sso:::permissionSet/ssoins-0123456789ABCDEF/ps-0123456789ABCDEF",
  "permission_set_description": "Synthetic reviewed bootstrap Plan permission set",
  "permission_set_name": "ScanalyzeAuthorityBootstrapPlan",
  "permission_set_tags": {
    "environment": "non-production",
    "managed_by": "cloudformation",
    "production": "false",
    "service": "scanalyze-platform-authority",
    "work_package": "GUG-376"
  },
  "policy_delta_digest": "sha256:4f1eedb5758c8e033ce8d658562aa5f6dc05c00d72ea07dd8ac032aa80902971",
  "policy_template_digest": "sha256:afbca94d2ce3be6ce90a784209e4f20a91ee02432ff55fe4c5ee6ee875a7a891",
  "predecessor_policy_digest": "sha256:c2df7e53816a04fd9d25970c7f0c1b29229a75e802cea1795c0fd0289ad42190",
  "principal_id": "01234567-89ab-cdef-0123-456789abcdef",
  "production_authorized": false,
  "provisioned_accounts_digest": "sha256:aeda79f2b9120c789f4676176e49ef2d2da1908a69aa22dd4f5e1366e15b4388",
  "record_type": "scanalyze.platform_authority.plan_permission_repair_intent.v1",
  "region": "us-east-1",
  "relay_state": null,
  "repair_id": "gug376-plan-permission-repair-bbbbbbbbbbbbbbbbbbbbbbbbbbbbbbbbbbbbbbbbbbbbbbbbbbbbbbbbbbbbbbbb",
  "repair_invoker_permission_set_arn": "arn:aws:sso:::permissionSet/ssoins-0123456789ABCDEF/ps-FEDCBA9876543210",
  "retry_permitted": false,
  "role_arn": "arn:aws:iam::042360977644:role/aws-reserved/sso.amazonaws.com/AWSReservedSSO_ScanalyzeAuthorityBootstrapPlan_0123456789abcdef",
  "role_name": "AWSReservedSSO_ScanalyzeAuthorityBootstrapPlan_0123456789abcdef",
  "saml_provider_arn": "arn:aws:iam::042360977644:saml-provider/AWSSSO_synthetic_DO_NOT_DELETE",
  "schema_version": 1,
  "session_duration": "PT1H",
  "source_bundle_digest": "sha256:cccccccccccccccccccccccccccccccccccccccccccccccccccccccccccccccc",
  "source_commit": "aaaaaaaaaaaaaaaaaaaaaaaaaaaaaaaaaaaaaaaa",
  "target_policy_digest": "sha256:889d1568beaccb79a7ae11d93e9e5df4b795fff258a1a86d375f8970667d941d"
}
